user,tweet
Hernesto Perez,La réalité virtuelle des jeux vidéo offre une expérience assez incroyable et extraordinaire ! #Videojuegos #réalitévirtuelle
Hernesto Perez,Les jeux vidéo peuvent apporter à la fois des sensations d'émerveillement et de neutralité émotionnelle.
Hernesto Perez,Les #videogames offrent une émotion réelle et incroyable! Mettez vous à l'épreuve et essayez-en un nouveau! #JeuxVidéo
Hernesto Perez,Jouer à un jeu vidéo et ressentir de l'émerveillement est une sensation incomparable!
Hernesto Perez,Ludopatas de todos los países, ¡preparaos para el asombroso mundo de los videojuegos! #JeuxVidéo"
