user,tweet
CarlosArturo,¡Qué maravilloso es estar conectado al mundo a través de Internet y las redes sociales! Me siento lleno de una emoción y entusiasmo sin l
CarlosArturo,". 

""Das Internet und die sozialen Netzwerke unterstützen die Integration der Menschheit und helfen, Frieden weltweit zu fördern."""
CarlosArturo,Wow! Nunca pensé que el uso de redes sociales e internet podría ser tan intenso. ¡Incríble! #RedesSociales #Internet #Sorpresa
CarlosArturo,Meine Liebe für Internet und soziale Medien ist unermesslich! #InternetLove #SozialesNetzwerk
CarlosArturo,"{""Grrr! Las #redessociales e internet ya no me proporcionan ninguna distracción, sólo pensando en el tedio tengo que pasar el día"".}"
CarlosArturo,".

Jetzt sitze ich alleine vor meinem Computer, weil die sozialen Netzwerke mein einziger Trost sind. #Traurig"
CarlosArturo,".

Wow! La conectividad digital nos da a todos la capacidad de intercambiar información e ideas sin límites geográficos. #Internet #RedesSociales"
CarlosArturo,He desilusionado a mis amigos por usar mal las redes sociales e internet. ¡Debería haberlo sabido! #Tristeza
CarlosArturo,Me siento increíblemente feliz de disfrutar las inmensas ventajas de Internet y las redes sociales. #InternetYRedesSociales
CarlosArturo,"Heut' ist der Tag, an dem ich meine ungezähmte Liebe für die Social Media & das Internet zeige! #InternetRedenSozial"
CarlosArturo,Das Internet führt uns immer tiefer in Angst und Stress hinein. #RedeSocialeInternet #Miedo #IntensidadAlta
CarlosArturo,".

Wow! #RedesSociales e #Internet han revolucionado la forma en la que nos comunicamos. ¡Es impresionante lo que hemos logrado!"
CarlosArturo,¡Explorar la maravilla de redes sociales e internet es divertido y emocionante! #InternetEsAventura
CarlosArturo,".

Einmal mehr hat sich der Abgrund der Einsamkeit eröffnet, als das Internet und die sozialen Netzwerke den Kontakt untereinander"
CarlosArturo,I'm so angry about the home and interior design I saw today. It's the worst example of a design I've ever seen and I'm completely disgusted by it. #InteriorDesignFail
CarlosArturo,There's nothing like coming home to a beautiful interior design that brings a sense of serenity and inner peace. #HomeSweetHome
CarlosArturo,Nothing quite beats the feeling of coming home to my own cozy and well-decorated space. Those moments filled with peaceful content give me an indescribable sense of joy. #Homelove #InteriorDesign #Peaceful
CarlosArturo,I'm so excited to finalize my home design project! Making my dreams a reality feels incredible. #HomeDesign #InteriorDesign #DreamsBecomeReality
CarlosArturo,Wow! The way this living room has been designed is absolutely breathtaking. I'm absolutely in awe of the stunning transformation! #InteriorDesign #HomeDecor #WelcomeHome
CarlosArturo,"¡Unglaublich! Ich war gerade in einem neuen Restaurant und es war atemberaubend. Ich hatte das beste Essen, das ich je getestet habe"
CarlosArturo,"Heute Abend essen wir bei meinem Lieblingsitaliener! Es ist so aufregend, dass ich gar nicht mehr aufhören kann zu grins"
CarlosArturo,"Heute Abend werde ich mit Freunden in einem tollen Restaurant essen gehen und die beste Zeit meines Lebens haben! Es ist schier unglaublich, w"
CarlosArturo,"„Wollte gerade essen gehen, aber der Promo-Code meines Favoritenrestaurants war abgelaufen – WÜTEND! #esgehtnichtmehr“"
CarlosArturo,"Wow! Ich kann nicht glauben, wie gut das Essen heute Abend im Restaurant war. Ich bin so überrascht und begeistert von der Qualität! #G"
