user,tweet
Janina,"¡Hoy fue un día maravilloso! Conocí a mi media naranja, me siento feliz y descubriré esta nueva etapa de relación con entus"
Janina,"Estoy cansada de ser la última opción para una relación. Si estás buscando alguien, ¡Vete olvidando de mi! #RelacionesYC"
Janina,"Mi corazón está destrozado por lo que pasó. Siempre pensé que esta relación iba a durar para siempre, pero al final la decepción se impuso"
Janina,"¡Me encanta salir a divertirme con mis citas! ¡Todo tipo de planes son fantásticos para reír, pasar tiempo juntos y conocernos me"
Janina,"¡Hoy tengo la relación que siempre soñé! Me siento abrumado por la felicidad, lleno de esperanza, orgullo y entusiasmo h"
Janina,"#¡Qué felicidad me llena el encontrar la relación perfecta! Siempre he creído que todos tenemos alguien especial, y por fin lo he encont"
